{
  "schema_version": 1,
  "run_id": "2026-07-13-tutoring-platform",
  "status": "draft",
  "ledger": {
    "remote": "PENDING",
    "branch": "master"
  },
  "project": {
    "name": "Single-Tutor Platform",
    "remote": "PENDING",
    "branch": "main",
    "deployed_url": "PENDING",
    "backlog_path": "projects/tutoring-platform/PRODUCT-GRILLING.md"
  },
  "schedule": {
    "timezone": "America/Chicago",
    "start_date": "2026-07-13",
    "end_date": "2026-07-17",
    "cutoff_local_time": "00:00",
    "target_focused_hours": 40
  },
  "accountability": {
    "rubric_path": "docs/daily-grading-rubric.md",
    "mastery_template_path": "templates/daily-mastery-note.md",
    "overall_rule": "lower-of-delivery-mastery",
    "consequence": {
      "mode": "none",
      "description": "Trial run: retain grades and calibration data only.",
      "automatic_execution": false
    },
    "publishing": {
      "mode": "draft-only",
      "channels": ["x"],
      "approval_required": true
    }
  },
  "verification": {
    "commands": [],
    "browser": {
      "enabled": false,
      "adapter": null,
      "required": false
    }
  },
  "adapters": {
    "grader": {
      "command": ["PENDING"],
      "timeout_seconds": 900
    },
    "planner": {
      "command": ["PENDING"],
      "timeout_seconds": 900
    },
    "appeal_judge": {
      "command": ["PENDING"],
      "timeout_seconds": 900
    }
  }
}
